{
  "schema_version": 1,
  "plugin_id": "edacraft-tcadcraft",
  "plugin_version": "1.1.0",
  "adapter_entry": ["python3", "./../../packages/execution/src/openroad_platform_execution/edacraft_adapter.py"],
  "capabilities": ["eda.tcad.physics_validation"],
  "supported_arch": ["aarch64"],
  "input_schema": {"type": "object"},
  "output_schema": {"type": "object", "required": ["status", "artifacts"]},
  "required_tools": ["git", "python3"],
  "default_timeout_seconds": 120,
  "artifact_rules": [
    {"kind": "device_geometry", "required": true},
    {"kind": "physics_validation", "required": true},
    {"kind": "report", "required": true},
    {"kind": "source_snapshot", "required": true}
  ],
  "environment": {
    "EDACRAFT_COMPONENT": "TCADCraft",
    "EDACRAFT_COMPONENT_SLUG": "tcadcraft",
    "EDACRAFT_EXPECTED_COMMIT": "739eee0f3ced8fc3cbb6f01b6cc89414758fd898",
    "PYTHONDONTWRITEBYTECODE": "1"
  }
}
